"","kitahara.tetsurou","","","","学術論文","","研究論文（国際会議プロシーディングス）","","","","英語","","共著(第一著者以外)","","An Android Application for Supporting Amateur Theatre","","Yuya Toyoda,Saori Nakajo,and Tetsuro Kitahara","","HCI International 2016 – Posters' Extended Abstracts,Part II","","","618","","558--563","","2016","7","","","","有","","無","","","","","","","","","","","","","","","","","abstract reviewed","","公開","","公開","","提供(公開)",
"","kitahara.tetsurou","","","","解説・総説","","研究論文（学術雑誌）","","","","日本語","","共著(第一著者)","特集「音楽を軸に拡がる情報科学」編集にあたって","","北原 鉄朗,永野 秀尚","","情報処理（情報処理学会誌）","","","","57","6","504--505","","2016","6","","","","","","無","","","","","","","","","","","","","","","","","","","公開","","公開","","提供(公開)",
"","kitahara.tetsurou","","","","学術論文","","研究論文（学術雑誌）","","","","日本語","","単著","自動採譜","","北原 鉄朗","","音響キーワードブック","","","","","","","","2016","3","","","","","","無","","","","","","","","","","","","","","","","","","","公開","","公開","","提供(公開)",
"","kitahara.tetsurou","","","","学術論文","","研究論文（国際会議プロシーディングス）","","","","英語","","共著(第一著者以外)","","Improving MIDI Guitar's Accuracy with NMF and Neural Net","","Masaki Otsuka and Tetsuro Kitahara","","Proceedings of the 16th Internatiol Society for Music Information Retrieval Conference (ISMIR 2015)","","","","","413--419","","2015","10","","","","有","","無","","","","","","","","","","","","","","","","","","","公開","","公開","","提供(公開)",
"","kitahara.tetsurou","","","","学術論文","","研究論文（国際会議プロシーディングス）","","","","英語","","共著(第一著者以外)","","A Music Recommender for a Group of People","","Jun-ichi Suzuki,Naoyuki Suetsugu,and Tetsuro Kitahara","","The 2015 International Society of Music Information Retrieval (ISMIR 2015)","","","","","","","2015","10","","","","有","","無","","","","","","","","","","","","","","","","","not reviewed","","公開","","公開","","提供(公開)",
"","kitahara.tetsurou","","","","学術論文","","研究論文（国際会議プロシーディングス）","","","","英語","","共著(第一著者)","","A Loop Sequencer That Selects Music Loops based on the Degree of Excitement","","Tetsuro Kitahara,Kosuke Iijima,Misaki Okada,Yuji Yamashita,and Ayaka Tsuruoka","","Proceedings of the 12th Sound and Music Computing Conference (SMC 2015)","","","","","435--438","","2015","7","","","","有","","無","","","","","","","","","","","","","","","","","","","公開","","公開","","提供(公開)",
"","kitahara.tetsurou","","","","学術論文","","研究論文（国際会議プロシーディングス）","","","","英語","","共著(第一著者以外)","","A Tambourine Support System to Improve the Atmosphere of Karaoke","","Takuya Kurihara,Naohiro Kinoshita,Ryunosuke Yamaguchi,and Tetsuro Kitahara","","Proceedings of the 12th Sound and Music Computing Conference (SMC 2015)","","","","","515--520","","2015","7","","","","有","","無","","","","","","","","","","","","","","","","","","","公開","","公開","","提供(公開)",
"","kitahara.tetsurou","","","","解説・総説","","研究論文（学術雑誌）","","","","日本語","","共著(第一著者)","自動作曲・自動編曲の現状と課題","","北原 鉄朗,深山 覚","","電子情報通信学会誌","","","","98","6","475--479","","2015","6","","","","","","無","","","","","","","","","","","","","","","","","","","公開","","公開","","提供(公開)",
"","kitahara.tetsurou","","","","学術論文","","研究論文（学術雑誌）","","","","英語","","共著(第一著者)","","Supporting Jogging at an Even Pace by Synchronizing Music Playback Speed with Runner's Pace","","Tetsuro Kitahara,Shunsuke Hokari,and Tatsuya Nagayasu","","IEICE Transactions on Information and Systems (Letter)","","","E98-D","4","968--971","","2015","4","","","","有","","無","","","","","","","","","","","","","","","","","","","公開","","公開","","提供(公開)",
"","kitahara.tetsurou","","","","学術論文","","研究論文（国際会議プロシーディングス）","","","","英語","","共著(第一著者)","","A Preliminary Experiment of Predicting Muscle Activity from Musical Acoustic Features","","Tetsuro Kitahara,Shogo Matsukata,Masaki Matsubara,and Hiroko Terasawa","","Proceedings of the 7th International Workshop on Machine Learning and Music (MML 2014)","","","","","","","2014","11","","","","有","","無","","","","","","","","","","","","","","","","","extended abstract","","公開","","公開","","提供(公開)",
"","kitahara.tetsurou","","","","学術論文","","研究論文（国際会議プロシーディングス）","","","","英語","","共著(第一著者)","","CrestMuse Toolkit: A Java-based Framework for Signal and Symbolic Music Processing","","Tetsuro Kitahara and Haruhiro Katayose","","Proceedings of 12th IEEE International Conference on Signal Processing (ICSP 2014)","","","","","616--620","","2014","10","","","","有","","無","","","","","","","","","","","","","","","","","","","公開","","公開","","提供(公開)",
"","kitahara.tetsurou","","","","学術論文","","研究論文（国際会議プロシーディングス）","","","","英語","","共著(第一著者以外)","","An On-line Algorithm of Guitar Performance Transcription Using Non-negative Matrix Factorization","","Masaki Otsuka and Tetsuro Kitahara","","Proceedings of 12th IEEE International Conference on Signal Processing (ICSP 2014)","","","","","621--624","","2014","10","","","","有","","無","","","","","","","","","","","","","","","","","","","公開","","公開","","提供(公開)",
"","kitahara.tetsurou","","","","学術論文","","研究論文（国際会議プロシーディングス）","","","","英語","","共著(第一著者以外)","","Towards Improvement of Transcription Accuracy of MIDI Guitar based on Integration with Audio Signal Processing","","Masaki Otsuka and Tetsuro Kitahara","","The 15th Annual Meeting of the International Society for Music Information Retrieval (ISMIR 2014)","","","","","","","2014","10","","","","有","","無","","","","","","","","","","","","","","","","","not reviewed","","公開","","公開","","提供(公開)",
"","kitahara.tetsurou","","","","学術論文","","研究論文（国際会議プロシーディングス）","","","","英語","","共著(第一著者)","","Short-term and Long-term Evaluations of Melody Editing Method based on Melodic Outline","","Tetsuro Kitahara and Yuichi Tsuchiya","","Proceedings of the Joint Conference of the 40th International Computer Music Conference (ICMC 2014) and the 11th Sound and Music Computing Conference (SMC 2014)","","","","","1204--1211","","2014","9","","","","有","","無","","","","","","","","","","","","","","","","","","","公開","","公開","","提供(公開)",
"","kitahara.tetsurou","","","","学術論文","","研究論文（学術雑誌）","","","","英語","","共著(第一著者以外)","","Four-part Harmonization Using Bayesian Networks: Pros and Cons of Introducing Chord Nodes","","Syunpei Suzuki and Tetsuro Kitahara","","Journal of New Music Research","","","43","3","331--353","","2014","9","","","","有","","無","","","","","","","","","","","","","","","","","","","公開","","公開","","提供(公開)",
"","kitahara.tetsurou","","","","学術論文","","研究論文（国際会議プロシーディングス）","","","","英語","","共著(第一著者)","","Music Synchronizer with Runner's Pace for Supporting Steady Pace Jogging","","Tetsuro Kitahara,Shunsuke Hokari,and Tatsuya Nagayasu","","HCI International 2014 - Posters’ Extended Abstracts","","","435","","343--348","","2014","6","","","","有","","無","","","","","","","","","","","","","","","","","abstract reviwed","","公開","","公開","","提供(公開)",
"","kitahara.tetsurou","","","","学術論文","","研究論文（国際会議プロシーディングス）","","","","英語","","共著(第一著者以外)","","A Spoken Dialogue System for Noisy Environment","","Kazuki Kogure,Masahiro Yoshinaga,Hikaru Suzuki,and Tetsuro Kitahara","","HCI International 2014 - Posters’Extended Abstracts","","","435","","577--582","","2014","6","","","","有","","無","","","","","","","","","","","","","","","","","abstract reviewed","","公開","","公開","","提供(公開)",
"","kitahara.tetsurou","","","","学術論文","","研究論文（国際会議プロシーディングス）","","","","英語","","共著(第一著者以外)","","Four-part Harmonization Using Probabilistic Models: Comparison of Models With and Without Chord Nodes","","Syunpei Suzuki and Tetsuro Kitahara","","Proceedings of the 10th Sound and Music Computing Conference (SMC 2013)","","","","","628--633","","2013","8","","","","有","","無","","","","","","","","","","","","","","","","","","","公開","","公開","","提供(公開)",
"","kitahara.tetsurou","","","","学術論文","","研究論文（国際会議プロシーディングス）","","","","英語","","共著(第一著者以外)","","Melodic Outline Extraction Method for Non-note-level Melody Editing","","Yuichi Tsuchiya and Tetsuro Kitahara","","Proceedings of the 10th Sound and Music Computing Conference (SMC 2013)","","","","","762--767","","2013","8","","","","有","","無","","","","","","","","","","","","","","","","","","","公開","","公開","","提供(公開)",
"","kitahara.tetsurou","","","","学術論文","","研究論文（国際会議プロシーディングス）","","","","英語","","共著(第一著者以外)","","Muscle Activity in Playing Trumpet: The Dependence on the Playable Pitch Region and the Experience of a Non-trumpet Brass Instrument Player","","Shogo Matsukata,Hiroko Terasawa,Masaki Matsubara,and Tetsuro Kitahara","","Proceedings of the Stokholm Musical Acoustics Conference 2013 (SMAC 2013)","","","","","529--533","","2013","8","","","","有","","無","","","","","","","","","","","","","","","","","","","公開","","公開","","提供(公開)",
"","kitahara.tetsurou","","","","学術論文","","研究論文（学術雑誌）","","","","日本語","","共著(第一著者以外)","音符を単位としない旋律編集のための旋律概形抽出手法","","土屋 裕一,北原 鉄朗","","情報処理学会論文誌（テクニカルノート）","","","","54","4","1302--1307","","2013","4","","","","有","","無","","","","","","","","","","","","","","","","","","","公開","","公開","","提供(公開)",
"","kitahara.tetsurou","","","","学術論文","","研究論文（学術雑誌）","","","","日本語","","共著(第一著者以外)","創作過程の分類に基づく自動音楽生成研究のサーベイ","","松原 正樹,深山 覚,奥村 健太,寺村 佳子,大村 英史,橋田 光代,北原 鉄朗","","コンピュータソフトウェア（日本ソフトウェア科学会 学会誌）","","","","30","1","101--118","","2013","3","","","","有","","無","","","","","","","","","","","","","","","","","","","公開","","公開","","提供(公開)",
"","kitahara.tetsurou","","","","解説・総説","","研究論文（学術雑誌）","","","","日本語","","単著","BOOK REVIEW: 音楽はなぜ心に響くのか---音楽音響学と音楽を解き明かす諸科学---","","北原 鉄朗","","日本バーチャル・リアリティ学会誌","","","","17","4","268","","2012","12","","","","","","無","","","","","","","","","","","","","","","","","","","公開","","公開","","提供(公開)",
"","kitahara.tetsurou","","","","学術論文","","研究論文（国際会議プロシーディングス）","","","","英語","","共著(第一著者)","","Hummi-Com: Humming-based Music Composition System","","Tetsuro Kitahara,Syohei Kimura,Yuu Suzuki,and Tomofumi Suzuki","","ACM Multimedia 2012 (Technical Demo)","","","","","1321--1322","","2012","10","","","","有","","無","","","","","","","","","","","","","","","","","","","公開","","公開","","提供(公開)",
"","kitahara.tetsurou","","","","学術論文","","研究論文（国際会議プロシーディングス）","","","","英語","","共著(第一著者以外)","","Four-part Harmonization Using A Bayesian Network","","Syunpei Suzuki and Tetsuro Kitahara","","Proceedings of the 5th International Workshop on Machine Learning and Music (MML 2012)","","","","","","","2012","6","","","","有","","無","","","","","","","","","","","","","","","","","extended abstract","","公開","","公開","","提供(公開)",
"","kitahara.tetsurou","","","","学術論文","","研究論文（国際会議プロシーディングス）","","","","英語","","共著(第一著者以外)","","Mutual Transform between Note Sequence and Melodic Envelope","","Yuichi Tsuchiya and Tetsuro Kitahara","","Proceedings of the 5th International Workshop on Machine Learning and Music (MML 2012)","","","","","","","2012","6","","","","有","","無","","","","","","","","","","","","","","","","","extended abstract","","公開","","公開","","提供(公開)",
"","kitahara.tetsurou","","","","学術論文","","研究論文（国際会議プロシーディングス）","","","","英語","","共著(第一著者)","","An Interactive Music Composition System based on Autonomous Maintenance of Musical Consistency","","Tetsuro Kitahara,Satoru Fukayama,Shigeki Sagayama,Haruhiro Katayose,and Noriko Nagata","","Proceedings of the 8th Sound and Music Computing Conference","","","","","362--367","","2011","7","","","","有","","無","","","","","","","","","","","","","","","","","","","公開","","公開","","提供(公開)",
"","kitahara.tetsurou","","","","学術論文","","研究論文（学術雑誌）","","","","英語","","共著(第一著者以外)","","Environmental Sound Recognition for Robot Audition using Matching-pursuit","","Nobuhide Yamakawa,Toru Takahashi,Tetsuro Kitahara,Tetsuya Ogata,and Hiroshi G. Okuno","","Modern Approaches in Applied Intelligence: 24th International Conference on Industrial Engineering and Other Applications of Applied Intelligent Systems,IEA/AIE 2011","","","","","1--10","","2011","6","","","","有","","無","","","","","","","","","","","","","","","","","","","公開","","公開","","提供(公開)",
"","kitahara.tetsurou","","","","その他","","研究論文（研究会，シンポジウム資料等）","","","","日本語","","共著(第一著者)","OrpheusBB：Human-in-the-loop型の自動作曲システム","","北原 鉄朗,深山 覚,片寄 晴弘,嵯峨山 茂樹,長田 典子","","情報処理学会 インタラクション2011（口頭発表）","","","","","","57--64","","2011","3","","","","有","","無","","","","","","","","","","","","","","","","","","","公開","","公開","","提供(公開)",
"","kitahara.tetsurou","","","","学術論文","","研究論文（学術雑誌）","","","","日本語","","共著(第一著者以外)","BayesianBand：ユーザとシステムが相互に予測し合うジャムセッションシステム","","北原 鉄朗,戸谷 直之,徳網 亮輔,片寄 晴弘","","情報処理学会論文誌（テクニカルノート）","","","","50","12","2949--2953","","2010","12","","","","有","","無","","","","","","","","","","","","","","","","","","","公開","","公開","","提供(公開)",
"","kitahara.tetsurou","","","","学術論文","","研究論文（国際会議プロシーディングス）","","","","英語","","共著(第一著者以外)","","Effects of Within- and Between-frame Temporal Variations in Power Spectra on Non-verbal Sound Recognition","","Nobuhide Yamakawa,Tetsuro Kitahara,Toru Takahashi,Kozunori Komatani,Tetsuya Ogata,and Hiroshi G. Okuno","","Proceedings of the 11th International Congress on Spoken Language Processing (Interspeech 2010)","","","","","","","2010","9","","","","有","","無","","","","","","","","","","","","","","","","","","","公開","","公開","","提供(公開)",
"","kitahara.tetsurou","","","","学術論文","","研究論文（学術雑誌）","","","","英語","","共著(第一著者以外)","","Singing Voice Representation Robust to Accompaniment Sounds and Its Application to Singer Identification and Vocal-timbre-similarity-based Music Information Retrieval","","Hiromasa Fujihara,Masataka Goto,Tetsuro Kitahara,and Hiroshi G. Okuno","","IEEE Transaction on Audio,Speech,and Language Processing","","","18","3","638--648","","2010","3","","","","有","","無","","","","","","","","","","","","","","","","","","","公開","","公開","","提供(公開)",
"","kitahara.tetsurou","","","","学術論文","","研究論文（学術雑誌）","","","","英語","","単著","","Mid-level Representations of Musical Audio Signals for Music Information Retrieval","","Tetsuro Kitahara","","Advances in Music Information Retrieval","","","","","","","2010","2","","","","","","無","","","","","","","","","","","","","","","","","","","公開","","公開","","提供(公開)",
"","kitahara.tetsurou","","","","解説・総説","","研究論文（学術雑誌）","","","","日本語","","単著","私のブックマーク「音楽情報処理」","","北原 鉄朗","","人工知能学会誌","","","","24","5","921--929","","2009","11","","","","","","無","","","","","","","","","","","","","","","","","","","公開","","公開","","提供(公開)",
"","kitahara.tetsurou","","","","学術論文","","研究論文（国際会議プロシーディングス）","","","","英語","","共著(第一著者以外)","","BayesianBand: Jam Session System based on Mutual Prediction by User and System","","Tetsuro Kitahara,Naoyuki Totani,Ryosuke Tokuami,and Haruhiro Katayose","","Entertainment Computing: Proceedings of the 10th International Conference on Entertainment Computing (ICEC 2009)","","","","","179--184","","2009","9","","","","有","","無","","","","","","","","","","","","","","","","","","","公開","","公開","","提供(公開)",
"","kitahara.tetsurou","","","","解説・総説","","研究論文（学術雑誌）","","","","日本語","","共著(第一著者以外)","音楽とヒューマンインタフェース","","平井 重行,橋田 光代,北原 鉄朗,竹川 佳成,片寄 晴弘","","情報処理","","","","50","8","756--763","","2009","8","","","","","","無","","","","","","","","","","","","","","","","","","","公開","","公開","","提供(公開)",
"","kitahara.tetsurou","","","","学術論文","","研究論文（学術雑誌）","","","","日本語","","共著(第一著者以外)","ベイジアンネットワークを用いた自動コードヴォイシングシステム","","北原 鉄朗,勝占 真規子,片寄 晴弘,長田 典子","","情報処理学会論文誌","","","","50","3","1067--1078","","2009","3","","","","有","","無","","","","","","","","","","","","","","","","","","","公開","","公開","","提供(公開)",
"","kitahara.tetsurou","","","","その他","","研究論文（研究会，シンポジウム資料等）","","","","日本語","","共著(第一著者以外)","BayesianBand：旋律の予測に基づいた自動伴奏システム","","北原 鉄朗,徳網 亮輔,戸谷 直之,橋本 寿政,片寄 晴弘","","インタラクション2009（インタラクティブ発表）","","","","","","31--32","","2009","3","","","","有","","無","","","","","","","","","","","","","","","","","","","公開","","公開","","提供(公開)",
"","kitahara.tetsurou","","","","学術論文","","研究論文（学術雑誌）","","","","日本語","","共著(第一著者以外)","ピアノ名演奏の演奏表現情報と音楽構造情報を対象とした音楽演奏表情データベースCrestMusePEDBの構築","","橋田 光代,松井 淑恵,北原 鉄朗,片寄 晴弘","","情報処理学会論文誌","","","","50","3","1090--1099","","2009","3","","","","有","","無","","","","","","","","","","","","","","","","","","","公開","","公開","","提供(公開)",
"","kitahara.tetsurou","","","","解説・総説","","研究論文（学術雑誌）","","","","日本語","","単著","音楽情報処理最前線！ 楽器で音楽が探せる 「楽器認識技術」が叶える音楽の新しい聴き方・探し方","","北原 鉄朗","","DTM Magazine","","","","176","","102--103","","2009","2","","","","","","無","","","","","","","","","","","","","","","","","","","公開","","公開","","提供(公開)",
"","kitahara.tetsurou","","","","学術論文","","研究論文（国際会議プロシーディングス）","","","","英語","","共著(第一著者以外)","","Music Genre Classification and Similarity Calculation Using Bass-line Features","","Tetsuro Kitahara,Yusuke Tsuchihashi,and Haruhiro Katayose","","Proceesings of the 10th IEEE International Symposium on Multimedia,Workshop on Multimedia Audio and Speech Processing","","","","","574--579","","2008","12","","","","有","","無","","","","","","","","","","","","","","","","","","","公開","","公開","","提供(公開)",
"","kitahara.tetsurou","","","","学術論文","","研究論文（国際会議プロシーディングス）","","","","英語","","共著(第一著者以外)","","Using Bass-line Features for Content-based MIR","","Yusuke Tsuchihashi,Tetsuro Kitahara,and Haruhiro Katayose","","Proceedings of the 9th International Conference on Music Information Retrieval ","","","","","620--625","","2008","9","","","","有","","無","","","","","","","","","","","","","","","","","","","公開","","公開","","提供(公開)",
"","kitahara.tetsurou","","","","学術論文","","研究論文（国際会議プロシーディングス）","","","","英語","","共著(第一著者以外)","","Computational Model for Automatic Chord Voicing based on Bayesian Network","","Tetsuro Kitahara,Makiko Katsura,Haruhiro Katayose,and Noriko Nagata","","Proceedings of the 10th International Conference on Music Perception and Cognition","","","","","395--398","","2008","8","","","","有","","無","","","","","","","","","","","","","","","","","","","公開","","公開","","提供(公開)",
"","kitahara.tetsurou","","","","学術論文","","研究論文（国際会議プロシーディングス）","","","","英語","","共著(第一著者以外)","","Computational Model of Congruency between Music and Video","","Tetsuro Kitahara,Masahiro Nishiyama,and Hiroshi G. Okuno","","Proceedings of the 10th International Conference on Music Perception and Cognition","","","","","","","2008","8","","","","有","","無","","","","","","","","","","","","","","","","","abstract only","","公開","","公開","","提供(公開)",
"","kitahara.tetsurou","","","","学術論文","","研究論文（国際会議プロシーディングス）","","","","英語","","共著(第一著者以外)","","Rencon: Performance Rendering Contest for Automated Music Systems","","Mitsuyo Hashida,Teresa M. Nakra,Haruhiro Katayose,Tadahiro Murao,Keiji Hirata,Kenji Suzuki,and Tetsuro Kitahara","","Proceedings of the 10th International Conference on Music Perception and Cognition","","","","","53--57","","2008","8","","","","有","","無","","","","","","","","","","","","","","","","","","","公開","","公開","","提供(公開)",
"","kitahara.tetsurou","","","","その他","","研究論文（研究会，シンポジウム資料等）","","","","日本語","","共著(第一著者以外)","楽器構成に着目した楽曲サムネイルとプレイリスト生成機能つき音楽プレイヤー","","戸谷 直之,北原 鉄朗,片寄 晴弘","","インタラクション2008（インタラクティブ発表）","","","","","","173--174","","2008","3","","","","有","","無","","","","","","","","","","","","","","","","","","","公開","","公開","","提供(公開)",
"","kitahara.tetsurou","","","","解説・総説","","研究論文（学術雑誌）","","","","日本語","","共著(第一著者以外)","楽曲の特徴量抽出と検索技術","","奥乃 博,北原 鉄朗,吉井 和佳","","電気学会誌","","","","127","7","417--420","","2007","7","","","","","","無","","","","","","","","","","","","","","","","","","","公開","","公開","","提供(公開)",
"","kitahara.tetsurou","","","","学術論文","","研究論文（学術雑誌）","","","","英語","","共著(第一著者以外)","","Instrogram: Probabilistic Representation of Instrument Existence for Polyphonic Music","","Tetsuro Kitahara,Masataka Goto,Kazunori Komatani,Tetsuya Ogata,and Hiroshi G. Okuno","","IPSJ Journal","","","48","1","214--226","","2007","1","","","","有","","無","","","","","","","","","","","","","","","","","第3回IPSJ Digital Courier船井若手奨励賞also published in IPSJ Digital Courier Vol.3,No.1,pp.1--13","","公開","","公開","","提供(公開)",
"","kitahara.tetsurou","","","","学術論文","","研究論文（学術雑誌）","","","","英語","","共著(第一著者以外)","","Instrument Identification in Polyphonic Music: Feature Weighting to Minimize Influence of Sound Overlaps","","Tetsuro Kitahara,Masataka Goto,Kazunori Komatani,Tetsuya Ogata,and Hiroshi G. Okuno","","EURASIP Journal on Advances in Signal Processing","","","2007","51979","1--15","","2007","","","","","有","","無","","","","","","","","","","","","","","","","","","","公開","","公開","","提供(公開)",
